{
  "classification": "first-party",
  "description": "Municipal statistics query service for Open City Planner modules.",
  "id": "statistics",
  "license": "AGPL-3.0-only",
  "name": "Statistics",
  "publisher": {
    "id": "oklabflensburg",
    "name": "OK Lab Flensburg"
  },
  "schema_version": 1,
  "source_repository": "https://github.com/oklabflensburg/ocp-module-statistics",
  "versions": [
    {
      "artifact": {
        "sha256": "cbefa3309642f4b06e8600c56552143d6b53d76472ddc574d889a67d3147e193",
        "url": "https://github.com/oklabflensburg/ocp-module-statistics/releases/download/v0.2.0/statistics-0.2.0.ocp"
      },
      "bundle_format_version": 1,
      "channel": "stable",
      "requires": {
        "host": ">=0.2.0,<1.0.0",
        "modules": {},
        "sdk": ">=1.15.0,<2.0.0"
      },
      "source_commit": "4525491995cddb7ad9670f456bba1a49e289f583",
      "source_tag": "v0.2.0",
      "version": "0.2.0"
    }
  ]
}
