{
  "schema_version": 1,
  "id": "analysis-areas",
  "name": "Analysis Areas",
  "description": "Spatial analysis areas and municipal statistics for Open City Planner.",
  "publisher": {
    "id": "oklabflensburg",
    "name": "OK Lab Flensburg"
  },
  "classification": "first-party",
  "source_repository": "https://github.com/oklabflensburg/ocp-module-analysis-areas",
  "license": "AGPL-3.0-only",
  "versions": [
    {
      "version": "1.0.0",
      "channel": "stable",
      "artifact": {
        "url": "https://packages.stadtplaner.oklabflensburg.de/modules/analysis-areas/1.0.0/analysis-areas-1.0.0.ocp",
        "sha256": "7006f31ea73f40e38f63d2065652c27ad5d3391ddcc8cfad2f149993efef3dcf"
      },
      "bundle_format_version": 1,
      "source_commit": "06afb05fed5dab8426e0e52392d3716ba46c980a",
      "source_tag": "v1.0.0",
      "requires": {
        "host": ">=0.2.0,<1.0.0",
        "sdk": ">=1.9.0,<2.0.0",
        "modules": {}
      }
    },
    {
      "version": "1.5.2",
      "channel": "stable",
      "artifact": {
        "url": "https://github.com/oklabflensburg/ocp-module-analysis-areas/releases/download/v1.5.2/analysis-areas-1.5.2.ocp",
        "sha256": "835a2745da15cdc17587324e451ea1b922ae0628738603c7a061d62407d08d58"
      },
      "bundle_format_version": 1,
      "source_commit": "89103403382ecd4fee992611f1011b58a0562d98",
      "source_tag": "v1.5.2",
      "requires": {
        "host": ">=0.2.0,<1.0.0",
        "sdk": ">=1.15.0,<2.0.0",
        "modules": {
          "statistics": ">=0.2.0,<1.0.0"
        }
      }
    },
    {
      "version": "1.5.3",
      "channel": "stable",
      "artifact": {
        "url": "https://github.com/oklabflensburg/ocp-module-analysis-areas/releases/download/v1.5.3/analysis-areas-1.5.3.ocp",
        "sha256": "88ead403d89209c155b78101676b691a642139991cf9fd0787115ccfe0338f6b"
      },
      "bundle_format_version": 1,
      "source_commit": "06a675a4237fca397b37c0aeb935ecd60557073a",
      "source_tag": "v1.5.3",
      "requires": {
        "host": ">=0.2.0,<1.0.0",
        "sdk": ">=1.15.0,<2.0.0",
        "modules": {
          "statistics": ">=0.2.0,<1.0.0"
        }
      }
    }
  ]
}
